{
  "$schema": "https://json-schema.org/draft/2020-12/schema",
  "$id": "https://raw.githubusercontent.com/sheepxux/SuperLoop/v2.0.0/protocol/proposal-decision.schema.json",
  "title": "SuperLoop Proposal Decision",
  "description": "A human decision bound to one exact revision and stable SHA-256 digest of a LoopProposal.",
  "type": "object",
  "additionalProperties": false,
  "required": [
    "apiVersion",
    "kind",
    "proposalId",
    "proposalRevision",
    "proposalSha256",
    "decision",
    "actorType",
    "actor",
    "decidedAt",
    "reason",
    "requestedChanges"
  ],
  "properties": {
    "apiVersion": {
      "type": "string",
      "const": "superloop/v2"
    },
    "kind": {
      "type": "string",
      "const": "LoopProposalDecision"
    },
    "proposalId": {
      "type": "string",
      "pattern": "^[a-z0-9][a-z0-9-]{1,62}[a-z0-9]$"
    },
    "proposalRevision": {
      "type": "integer",
      "minimum": 1
    },
    "proposalSha256": {
      "type": "string",
      "pattern": "^[a-f0-9]{64}$"
    },
    "decision": {
      "type": "string",
      "enum": ["approve", "reject", "request-changes"]
    },
    "actorType": {
      "type": "string",
      "const": "human"
    },
    "actor": {
      "type": "string",
      "minLength": 1,
      "pattern": "\\S"
    },
    "decidedAt": {
      "type": "string",
      "pattern": "^\\d{4}-\\d{2}-\\d{2}T\\d{2}:\\d{2}:\\d{2}(?:\\.\\d+)?Z$"
    },
    "reason": {
      "type": "string",
      "minLength": 5,
      "pattern": "\\S"
    },
    "requestedChanges": {
      "type": "array",
      "uniqueItems": true,
      "items": {
        "type": "string",
        "minLength": 3,
        "pattern": "\\S"
      }
    }
  },
  "allOf": [
    {
      "if": {
        "properties": {
          "decision": { "const": "request-changes" }
        },
        "required": ["decision"]
      },
      "then": {
        "properties": {
          "requestedChanges": { "type": "array", "minItems": 1 }
        }
      },
      "else": {
        "properties": {
          "requestedChanges": { "type": "array", "maxItems": 0 }
        }
      }
    }
  ]
}
