{
  "apiVersion": "superloop/v2",
  "kind": "LoopProposalDecision",
  "proposalId": "example-loop-proposal",
  "proposalRevision": 1,
  "proposalSha256": "0000000000000000000000000000000000000000000000000000000000000000",
  "decision": "approve",
  "actorType": "human",
  "actor": "human-operator",
  "decidedAt": "2026-07-15T00:00:00Z",
  "reason": "The proposed goal, evidence, budgets, and human gates match the intended work.",
  "requestedChanges": []
}
